{
  "id": "order_fulfillment",
  "name": "order_fulfillment",
  "description": "Fulfill an order end-to-end",
  "status": "created",
  "created_at": "2026-03-30T12:00:00Z",
  "updated_at": "2026-03-30T12:00:00Z",
  "steps": [
    {
      "id": "validate_order",
      "capability_name": "orders.validate",
      "arguments": {}
    },
    {
      "id": "reserve_inventory",
      "capability_name": "inventory.reserve",
      "arguments": {}
    },
    {
      "id": "process_payment",
      "capability_name": "payments.process",
      "arguments": {}
    },
    {
      "id": "create_shipping",
      "capability_name": "shipping.create",
      "arguments": {}
    }
  ]
}
